{
  "schema_version": "3.0",
  "description": "Simple Model — 多任务/多模态项目架构：模块定义、调用关系、数据流",
  "conventions": {
    "depends_on": "该服务直接调用的上游服务列表（仅记录直接调用，不展开传递依赖）",
    "produces": "该服务产出的核心 artifact / 数据，串联起来即完整数据流",
    "optional": "true 表示按需启用的扩展服务，false 或缺省为核心服务",
    "pipeline.stages": "按 order 升序执行的顺序阶段，构成完整训练-部署的 happy path",
    "pipeline.cross_cutting": "横切关注点：不参与主流程串行顺序，而是在多个阶段并行注入",
    "supported_tasks": "架构显式支持的任务清单，是 Auto* 派发的依据"
  },
  "phases": [
    {
      "phase": "configure",
      "order": 1,
      "mode": "sequential",
      "description": "加载并校验配置，按任务名拉取 AutoConfig",
      "core_components": [
        "ConfigLoader",
        "ConfigComposer",
        "ConfigValidator",
        "TaskRegistry",
        "AutoConfig"
      ]
    },
    {
      "phase": "prepare_data",
      "order": 2,
      "mode": "sequential",
      "description": "按任务拉取 Processor，加载、解析、切分、组装 batch",
      "core_components": [
        "AutoProcessor",
        "DataLoader",
        "DataParser",
        "DataSplitter",
        "Tokenizer",
        "ImageProcessor",
        "AudioFeatureExtractor",
        "Collator"
      ],
      "optional_components": [
        "DataCleaner",
        "VideoProcessor",
        "DataAugmenter",
        "DataCache",
        "DataVersion"
      ]
    },
    {
      "phase": "build_model",
      "order": 3,
      "mode": "sequential",
      "description": "按任务从 ModelRegistry 拉取 Backbone+Neck+Head，组装模型与优化器",
      "core_components": [
        "AutoModel",
        "ModelRegistry",
        "Backbone",
        "Neck",
        "Head",
        "ModelBuilder",
        "LossFunction",
        "Optimizer",
        "LRScheduler"
      ]
    },
    {
      "phase": "init_distributed",
      "order": 4,
      "mode": "select_one",
      "description": "按配置挑选一种分布式后端初始化进程组",
      "core_components": [
        "ClusterMonitor",
        "RankSync"
      ],
      "select_one_of": [
        "DDPLauncher",
        "FSDPManager",
        "DeepSpeedEngine",
        "TensorParallel"
      ]
    },
    {
      "phase": "train",
      "order": 5,
      "mode": "sequential",
      "description": "训练主循环，含混合精度、梯度管理、EMA、回调与检查点",
      "core_components": [
        "Trainer",
        "MixedPrecision",
        "Callback",
        "Checkpoint"
      ],
      "optional_components": [
        "GradientAccumulator",
        "GradientClipper",
        "EMA"
      ]
    },
    {
      "phase": "verify",
      "order": 6,
      "mode": "sequential",
      "description": "按任务路由到对应指标集并生成报告",
      "core_components": [
        "Validator",
        "TaskEvaluator",
        "MetricsCalculator",
        "Reporter"
      ],
      "optional_components": [
        "NLPMetrics",
        "VisionMetrics",
        "SpeechMetrics",
        "RankingMetrics",
        "GenerationMetrics",
        "Benchmark",
        "RobustnessProbe"
      ]
    },
    {
      "phase": "compress",
      "order": 7,
      "mode": "select_subset",
      "description": "按需执行量化、剪枝、蒸馏、图优化并导出跨平台格式",
      "core_components": [
        "Exporter"
      ],
      "select_subset_of": [
        "Quantizer",
        "Pruner",
        "Distiller",
        "GraphOptimizer"
      ]
    },
    {
      "phase": "deploy",
      "order": 8,
      "mode": "sequential",
      "description": "上线推理服务、暴露 API、灰度发布并接入漂移监控",
      "core_components": [
        "InferenceEngine",
        "ModelServer",
        "APIGateway"
      ],
      "optional_components": [
        "CanaryDeployer",
        "DriftDetector"
      ]
    }
  ],
  "cross_cutting": [
    {
      "name": "tracking",
      "description": "贯穿全程的实验追踪、产物记录与可视化",
      "injects_into": [
        "configure",
        "train",
        "verify",
        "compress",
        "deploy"
      ],
      "components": [
        "ExperimentTracker",
        "MetricRecorder",
        "ArtifactStore",
        "Visualizer"
      ]
    },
    {
      "name": "repro",
      "description": "贯穿全程的可复现性保障：种子、环境快照、依赖锁、审计",
      "injects_into": [
        "configure",
        "prepare_data",
        "train",
        "verify"
      ],
      "components": [
        "SeedManager",
        "EnvSnapshot",
        "AuditLogger"
      ]
    },
    {
      "name": "profile",
      "description": "在 train 与 deploy 阶段按需启用的性能与显存分析",
      "injects_into": [
        "train",
        "deploy"
      ],
      "default_enabled": false,
      "components": [
        "Profiler",
        "MemoryProfiler",
        "BottleneckAnalyzer"
      ]
    },
    {
      "name": "hpo",
      "description": "外层循环：包裹 configure→train→verify，按 trial 反复执行挑选最优超参",
      "injects_into": [
        "train",
        "verify"
      ],
      "default_enabled": false,
      "components": [
        "SearchSpace",
        "SweepGenerator",
        "TrialScheduler",
        "HPOTuner",
        "EarlyStopper",
        "NASEngine"
      ]
    },
    {
      "name": "pipeline",
      "description": "工作流编排：声明 DAG、缓存中间产物、按策略重试",
      "injects_into": [
        "configure",
        "prepare_data",
        "build_model",
        "train",
        "verify",
        "compress",
        "deploy"
      ],
      "components": [
        "WorkflowScheduler",
        "TaskDAG",
        "PipelineCache",
        "RetryPolicy"
      ]
    },
    {
      "name": "test",
      "description": "CI 与合并前门禁处运行的测试与质量门槛",
      "injects_into": [
        "verify"
      ],
      "components": [
        "UnitTest",
        "IntegrationTest",
        "RegressionTest",
        "QualityGate"
      ]
    }
  ],
  "modules": [
    {
      "name": "verify",
      "description": "验证、评估、基准测试与报告生成，含任务相关指标",
      "components": [
        {
          "name": "Validator",
          "description": "用于在验证集上对模型进行推理评估",
          "exports": [
            "predictions"
          ],
          "imports": [
            "Checkpoint",
            "DataSplitter",
            "AutoProcessor",
            "Collator"
          ],
          "todos": [
            {
              "task": "实现 model.eval() + no_grad 推理",
              "priority": "high",
              "id": "validator_1",
              "status": "done",
              "blocks": [
                "reporter_1"
              ]
            },
            {
              "task": "支持 TTA（test-time augmentation）",
              "priority": "medium",
              "id": "validator_2",
              "status": "done"
            },
            {
              "task": "汇总 predictions 与 labels 给后续 metrics",
              "priority": "high",
              "id": "validator_3",
              "status": "done"
            }
          ]
        },
        {
          "name": "MetricsCalculator",
          "description": "用于计算通用分类/回归指标（acc / F1 / MSE / AUC ...）",
          "exports": [
            "scalar_metrics"
          ],
          "imports": [
            "Validator"
          ]
        },
        {
          "name": "NLPMetrics",
          "description": "用于计算 NLP 专用指标（BLEU / ROUGE / METEOR / 困惑度）",
          "exports": [
            "nlp_metric_scores"
          ],
          "imports": [
            "Validator",
            "Tokenizer"
          ],
          "optional": true
        },
        {
          "name": "VisionMetrics",
          "description": "用于计算视觉专用指标（mAP / IoU / FID / IS）",
          "exports": [
            "vision_metric_scores"
          ],
          "imports": [
            "Validator"
          ],
          "optional": true
        },
        {
          "name": "SpeechMetrics",
          "description": "用于计算语音专用指标（WER / CER）",
          "exports": [
            "speech_metric_scores"
          ],
          "imports": [
            "Validator"
          ],
          "optional": true
        },
        {
          "name": "RankingMetrics",
          "description": "用于计算检索/排序指标（NDCG / MRR / MAP）",
          "exports": [
            "ranking_scores"
          ],
          "imports": [
            "Validator"
          ],
          "optional": true
        },
        {
          "name": "GenerationMetrics",
          "description": "用于计算生成质量指标（BERTScore / CLIPScore）",
          "exports": [
            "generation_scores"
          ],
          "imports": [
            "Validator"
          ],
          "optional": true
        },
        {
          "name": "TaskEvaluator",
          "description": "用于按任务名路由到对应指标集并汇总结果",
          "exports": [
            "task_metrics"
          ],
          "imports": [
            "TaskRegistry",
            "Validator",
            "MetricsCalculator"
          ]
        },
        {
          "name": "Benchmark",
          "description": "用于在标准基准上对比模型性能与吞吐",
          "exports": [
            "benchmark_report"
          ],
          "imports": [
            "TaskEvaluator"
          ],
          "optional": true
        },
        {
          "name": "RobustnessProbe",
          "description": "用于评估模型在对抗样本、噪声、分布漂移下的鲁棒性",
          "exports": [
            "robustness_report"
          ],
          "imports": [
            "Validator"
          ],
          "optional": true
        },
        {
          "name": "Reporter",
          "description": "用于生成指标矩阵、对比表与可视化报告",
          "exports": [
            "report"
          ],
          "imports": [
            "TaskEvaluator",
            "Benchmark",
            "RobustnessProbe"
          ],
          "todos": [
            {
              "task": "输出 JSON 指标摘要",
              "priority": "high",
              "id": "reporter_1",
              "status": "done",
              "blocks": [
                "reporter_2"
              ]
            },
            {
              "task": "生成 Markdown / HTML 对比报告",
              "priority": "medium",
              "id": "reporter_2",
              "status": "done"
            },
            {
              "task": "支持接入 MLflow / W&B 自动记录",
              "priority": "medium",
              "id": "reporter_3",
              "status": "done"
            }
          ]
        }
      ]
    }
  ]
}
